{
  "morningSync": {
    "ranAt": "2026-03-24T03:18:04.901Z",
    "status": "success"
  },
  "eveningSync": {
    "ranAt": "2026-03-31T14:48:06.712Z",
    "status": "success"
  },
  "dailyFirefliesSync": {
    "ranAt": "2026-03-31T20:05:20.360Z",
    "status": "success",
    "dayKey": "2026-03-31"
  },
  "weeklyCustomerPulseDigest": {
    "ranAt": "2026-03-20T07:20:00.000Z",
    "status": "success",
    "weekKey": "2026-W12",
    "windowStart": "2026-03-13",
    "windowEnd": "2026-03-19"
  }
}